CODIGO,DISTRITO,DEPARTAMENTO,MUNICIPIO,ESTABLECIMIENTO,DIRECCION,TELEFONO,SUPERVISOR,DIRECTOR,NIVEL,SECTOR,AREA,STATUS,MODALIDAD,JORNADA,PLAN,DEPARTAMENTAL,ARCHIVO_ORIGEN,ESTABLECIMIENTO_LIMPIO,DIRECCION_LIMPIA,TELEFONO_LIMPIO,DIRECTOR_LIMPIO,SUPERVISOR_LIMPIO,MUNICIPIO_LIMPIO,AREA_LIMPIO,SECTOR_LIMPIO,MODALIDAD_LIMPIO,JORNADA_LIMPIO,PLAN_LIMPIO
16-01-0138-46,16-031,ALTA VERAPAZ,COBAN,COLEGIO COBAN,KM.2 SALIDA A SAN JUAN CHAMELCO ZONA 8,77945104,PATRICIO NAJARRO ASENCIO,GUSTAVO ADOLFO SIERRA POP,DIVERSIFICADO,PRIVADO,URBANA,ABIERTA,MONOLINGUE,MATUTINA,DIARIO(REGULAR),ALTA VERAPAZ,alta_verapaz,COLEGIO COBAN,KILOMETRO.2 SALIDA A SAN JUAN CHAMELCO ZONA 8,77945104,GUSTAVO ADOLFO SIERRA POP,PATRICIO NAJARRO ASENCIO,COBÁN,URBANA,PRIVADO,MONOLINGUE,MATUTINA,DIARIO(REGULAR)
16-01-0139-46,16-031,ALTA VERAPAZ,COBAN,COLEGIO PARTICULAR MIXTO VERAPAZ,KM 209.5 ENTRADA A LA CIUDAD,77367402,PATRICIO NAJARRO ASENCIO,GILMA DOLORES GUAY PAZ DE LEAL,DIVERSIFICADO,PRIVADO,URBANA,ABIERTA,MONOLINGUE,MATUTINA,DIARIO(REGULAR),ALTA VERAPAZ,alta_verapaz,COLEGIO PARTICULAR MIXTO IMPERIAL,KILOMETRO 209.5 ENTRADA A LA CIUDAD,77367402,GILMA DOLORES GUAY PAZ DE LEAL,PATRICIO NAJARRO ASENCIO,COBÁN,URBANA,PRIVADO,MONOLINGUE,MATUTINA,DIARIO(REGULAR)
16-01-0140-46,16-031,ALTA VERAPAZ,COBAN,"COLEGIO ""LA INMACULADA""",7A. AVENIDA 11-109 ZONA 6,78232301,PATRICIO NAJARRO ASENCIO,VIRGINIA SOLANO SERRANO,DIVERSIFICADO,PRIVADO,URBANA,ABIERTA,MONOLINGUE,MATUTINA,DIARIO(REGULAR),ALTA VERAPAZ,alta_verapaz,COLEGIO LA INMACULADA,7A. AVENIDA 11-109 ZONA 6,78232301,VIRGINIA SOLANO SERRANO,PATRICIO NAJARRO ASENCIO,COBÁN,URBANA,PRIVADO,MONOLINGUE,MATUTINA,DIARIO(REGULAR)
16-01-0141-46,16-005,ALTA VERAPAZ,COBAN,ESCUELA NACIONAL DE CIENCIAS COMERCIALES,2A CALLE 11-10 ZONA 2,79514215,NORA LILIANA FIGUEROA HERNNDEZ,HɃTOR ROLANDO CHUN POOU,DIVERSIFICADO,OFICIAL,URBANA,ABIERTA,MONOLINGUE,MATUTINA,DIARIO(REGULAR),ALTA VERAPAZ,alta_verapaz,ESCUELA NACIONAL DE CIENCIAS COMERCIALES,2A CALLE 11-10 ZONA 2,79514215,HɃTOR ROLANDO CHUN POOU,NORA LILIANA FIGUEROA HERNNDEZ,COBÁN,URBANA,OFICIAL,MONOLINGUE,MATUTINA,DIARIO(REGULAR)
16-01-0142-46,16-005,ALTA VERAPAZ,COBAN,INSTITUTO NORMAL MIXTO DEL NORTE 'EMILIO ROSALES PONCE',3A AVE 6-23 ZONA 11,79521468,NORA LILIANA FIGUEROA HERNNDEZ,VICTOR HUGO DOM͎GUEZ REYES,DIVERSIFICADO,OFICIAL,URBANA,ABIERTA,BILINGUE,VESPERTINA,DIARIO(REGULAR),ALTA VERAPAZ,alta_verapaz,INSTITUTO NORMAL MIXTO DEL NORTE EMILIO ROSALES PONCE,3A AVENIDA 6-23 ZONA 11,79521468,VICTOR HUGO DOMGUEZ REYES,NORA LILIANA FIGUEROA HERNNDEZ,COBÁN,URBANA,OFICIAL,BILINGUE,VESPERTINA,DIARIO(REGULAR)
16-01-0143-46,16-031,ALTA VERAPAZ,COBAN,COLEGIO PARTICULAR MIXTO IMPERIAL,5A. CALLE 1-9 ZONA 3,57101061,PATRICIO NAJARRO ASENCIO,MYNOR GUSTAVO IPIс ESPAс,DIVERSIFICADO,PRIVADO,URBANA,ABIERTA,MONOLINGUE,DOBLE,FIN DE SEMANA,ALTA VERAPAZ,alta_verapaz,COLEGIO PARTICULAR MIXTO IMPERIAL,5A. CALLE 1-9 ZONA 3,57101061,MYNOR GUSTAVO IPIС ESPAС,PATRICIO NAJARRO ASENCIO,COBÁN,URBANA,PRIVADO,MONOLINGUE,DOBLE,FIN DE SEMANA
16-01-0155-46,16-031,ALTA VERAPAZ,COBAN,"LICEO ""MODERNO LATINO""",11 AVENIDA 5-17 ZONA 4,79522555,PATRICIO NAJARRO ASENCIO,HɃTOR ARMANDO TEYUL CHEN,DIVERSIFICADO,PRIVADO,URBANA,ABIERTA,MONOLINGUE,DOBLE,FIN DE SEMANA,ALTA VERAPAZ,alta_verapaz,LICEO MODERNO LATINO,11 AVENIDA 5-17 ZONA 4,79522555,HɃTOR ARMANDO TEYUL CHEN,PATRICIO NAJARRO ASENCIO,COBÁN,URBANA,PRIVADO,MONOLINGUE,DOBLE,FIN DE SEMANA
16-01-0428-46,16-005,ALTA VERAPAZ,COBAN,INSTITUTO NACIONAL DE EDUCACION DIVERSIFICADA,"DIAGONAL 08 8-05 ZONA 8, BARRIO CANTӎ LAS CASAS",77930045,NORA LILIANA FIGUEROA HERNNDEZ,HELSON MARCO CHɎ GUTIERREZ,DIVERSIFICADO,OFICIAL,RURAL,ABIERTA,MONOLINGUE,VESPERTINA,DIARIO(REGULAR),ALTA VERAPAZ,alta_verapaz,INSTITUTO NACIONAL DE EDUCACION DIVERSIFICADA,"DIAGONAL 08 8-05 ZONA 8, BARRIO CANTӍ LAS CASAS",77930045,HELSON MARCO CHɎ GUTIERREZ,NORA LILIANA FIGUEROA HERNNDEZ,COBÁN,RURAL,OFICIAL,MONOLINGUE,VESPERTINA,DIARIO(REGULAR)
16-01-0471-46,16-031,ALTA VERAPAZ,COBAN,"COLEGIO DE INFORMATICA ""CENINFAV""",12 AV. 2-12 ZONA 1,79545566,PATRICIO NAJARRO ASENCIO,MARIA MAGDALENA BOL CU,DIVERSIFICADO,PRIVADO,URBANA,ABIERTA,MONOLINGUE,VESPERTINA,DIARIO(REGULAR),ALTA VERAPAZ,alta_verapaz,COLEGIO DE INFORMATICA CENINFAV,12 AVENIDA. 2-12 ZONA 1,79545566,MARIA MAGDALENA BOL CU,PATRICIO NAJARRO ASENCIO,COBÁN,URBANA,PRIVADO,MONOLINGUE,VESPERTINA,DIARIO(REGULAR)
16-01-0481-46,16-031,ALTA VERAPAZ,COBAN,LICEO AMERICANO DEL NORTE,5TA. CALLE 2-23 ZONA 4,79514754,PATRICIO NAJARRO ASENCIO,JOSɠCUPERTINO REYES GARCIA,DIVERSIFICADO,PRIVADO,URBANA,ABIERTA,MONOLINGUE,MATUTINA,DIARIO(REGULAR),ALTA VERAPAZ,alta_verapaz,LICEO AMERICANO DEL NORTE,5TA. CALLE 2-23 ZONA 4,79514754,JOSƓCUPERTINO REYES GARCIA,PATRICIO NAJARRO ASENCIO,COBÁN,URBANA,PRIVADO,MONOLINGUE,MATUTINA,DIARIO(REGULAR)
16-01-0483-46,16-031,ALTA VERAPAZ,COBAN,LICEO AMERICANO DEL NORTE,5TA. CALLE 2-23 ZONA 4,79514754,PATRICIO NAJARRO ASENCIO,JOSɠCUPERTINO REYES GARCIA,DIVERSIFICADO,PRIVADO,URBANA,ABIERTA,MONOLINGUE,DOBLE,FIN DE SEMANA,ALTA VERAPAZ,alta_verapaz,LICEO AMERICANO DEL NORTE,5TA. CALLE 2-23 ZONA 4,79514754,JOSƓCUPERTINO REYES GARCIA,PATRICIO NAJARRO ASENCIO,COBÁN,URBANA,PRIVADO,MONOLINGUE,DOBLE,FIN DE SEMANA
16-01-0558-46,16-005,ALTA VERAPAZ,COBAN,"INSTITUTO NORMAL PREPRIMARIA BILINGUE ADSCRITO AL INSTITUTO NORMAL MIXTO DEL NORTE ""EMILIO ROSALES PONCE""",3A. AVE. 6-23 ZONA 11,79521468,NORA LILIANA FIGUEROA HERNNDEZ,VICTOR HUGO DOM͎GUEZ REYES,DIVERSIFICADO,OFICIAL,URBANA,ABIERTA,MONOLINGUE,VESPERTINA,DIARIO(REGULAR),ALTA VERAPAZ,alta_verapaz,INSTITUTO NORMAL PREPRIMARIA BILINGUE ADSCRITO AL INSTITUTO NORMAL MIXTO DEL NORTE EMILIO ROSALES PONCE,3A. AVENIDA. 6-23 ZONA 11,79521468,VICTOR HUGO DOMGUEZ REYES,NORA LILIANA FIGUEROA HERNNDEZ,COBÁN,URBANA,OFICIAL,MONOLINGUE,VESPERTINA,DIARIO(REGULAR)
16-01-0559-46,16-005,ALTA VERAPAZ,COBAN,INSTITUTO NORMAL PRIMARIA BILINGUE INTERCULTURAL ADS. AL INSTITUTO EMILIO ROSALES PONCE,3A. AVE. 6-23 ZONA 11,79521468,NORA LILIANA FIGUEROA HERNNDEZ,VICTOR HUGO DOM͎GUEZ REYES,DIVERSIFICADO,OFICIAL,URBANA,ABIERTA,MONOLINGUE,VESPERTINA,DIARIO(REGULAR),ALTA VERAPAZ,alta_verapaz,INSTITUTO NORMAL PRIMARIA BILINGUE INTERCULTURAL ADS. AL INSTITUTO EMILIO ROSALES PONCE,3A. AVENIDA. 6-23 ZONA 11,79521468,VICTOR HUGO DOMGUEZ REYES,NORA LILIANA FIGUEROA HERNNDEZ,COBÁN,URBANA,OFICIAL,MONOLINGUE,VESPERTINA,DIARIO(REGULAR)
16-01-0563-46,16-031,ALTA VERAPAZ,COBAN,CENTRO DE FORMACION INTEGRAL LAS CONCHAS FMG,ALDEA LAS CONCHAS,79522793,PATRICIO NAJARRO ASENCIO,DAVID WALDEMAR URRUTIA CHOC,DIVERSIFICADO,PRIVADO,RURAL,ABIERTA,MONOLINGUE,VESPERTINA,DIARIO(REGULAR),ALTA VERAPAZ,alta_verapaz,CENTRO DE FORMACION INTEGRAL LAS CONCHAS FMG,ALDEA LAS CONCHAS,79522793,DAVID WALDEMAR URRUTIA CHOC,PATRICIO NAJARRO ASENCIO,COBÁN,RURAL,PRIVADO,MONOLINGUE,VESPERTINA,DIARIO(REGULAR)
16-01-0565-46,16-031,ALTA VERAPAZ,COBAN,"INSTITUTO MIXTO PRIVADO ""SALUD Y DESARROLLO""",DIAGNONAL 1 1-26 ZONA 1,51922050,PATRICIO NAJARRO ASENCIO,SAMANTHA GABRIELA DE LA CRUZ MORALES,DIVERSIFICADO,PRIVADO,URBANA,ABIERTA,MONOLINGUE,DOBLE,FIN DE SEMANA,ALTA VERAPAZ,alta_verapaz,INSTITUTO MIXTO PRIVADO SALUD Y DESARROLLO,DIAGNONAL 1 1-26 ZONA 1,51922050,SAMANTHA GABRIELA DE LA CRUZ MORALES,PATRICIO NAJARRO ASENCIO,COBÁN,URBANA,PRIVADO,MONOLINGUE,DOBLE,FIN DE SEMANA
16-01-0568-46,16-031,ALTA VERAPAZ,COBAN,INSTITUTO PRIVADO RAUL CHENAL HEINEMANN,5A. CALLE 1-06 ZONA 3,79510413,PATRICIO NAJARRO ASENCIO,SILVIA BEATRIZ SOTO CHɎ,DIVERSIFICADO,PRIVADO,URBANA,ABIERTA,MONOLINGUE,NOCTURNA,DIARIO(REGULAR),ALTA VERAPAZ,alta_verapaz,INSTITUTO PRIVADO RAUL CHENAL HEINEMANN,5A. CALLE 1-06 ZONA 3,79510413,SILVIA BEATRIZ SOTO CHɎ,PATRICIO NAJARRO ASENCIO,COBÁN,URBANA,PRIVADO,MONOLINGUE,NOCTURNA,DIARIO(REGULAR)
16-01-0572-46,16-031,ALTA VERAPAZ,COBAN,LICEO MIGUEL ANGEL ASTURIAS,7A. CALLE 1-13 ZONA 3,79511103,PATRICIO NAJARRO ASENCIO,JAYRON ARIEL COY CACAO,DIVERSIFICADO,PRIVADO,URBANA,ABIERTA,MONOLINGUE,MATUTINA,DIARIO(REGULAR),ALTA VERAPAZ,alta_verapaz,LICEO MIGUEL ANGEL ASTURIAS,7A. CALLE 1-13 ZONA 3,79511103,JAYRON ARIEL COY CACAO,PATRICIO NAJARRO ASENCIO,COBÁN,URBANA,PRIVADO,MONOLINGUE,MATUTINA,DIARIO(REGULAR)
16-01-0573-46,16-031,ALTA VERAPAZ,COBAN,COLEGIO CRISTIANO BILINGUE VERBO,4A. CALLE A 4-32 ZONA 8,77945181,PATRICIO NAJARRO ASENCIO,LESLY EUGENIA CHOCOOJ VIDAURRE,DIVERSIFICADO,PRIVADO,URBANA,ABIERTA,MONOLINGUE,MATUTINA,DIARIO(REGULAR),ALTA VERAPAZ,alta_verapaz,COLEGIO CRISTIANO BILINGUE VERBO,4A. CALLE A 4-32 ZONA 8,77945181,LESLY EUGENIA CHOCOOJ VIDAURRE,PATRICIO NAJARRO ASENCIO,COBÁN,URBANA,PRIVADO,MONOLINGUE,MATUTINA,DIARIO(REGULAR)
16-01-0574-46,16-005,ALTA VERAPAZ,COBAN,ESCUELA NACIONAL DE CIENCIAS COMERCIALES,2A. CALLE 11-10 ZONA 2,53530198,NORA LILIANA FIGUEROA HERNNDEZ,HɃTOR ROLANDO CHUN POOU,DIVERSIFICADO,OFICIAL,URBANA,ABIERTA,MONOLINGUE,VESPERTINA,DIARIO(REGULAR),ALTA VERAPAZ,alta_verapaz,ESCUELA NACIONAL DE CIENCIAS COMERCIALES,2A. CALLE 11-10 ZONA 2,53530198,HɃTOR ROLANDO CHUN POOU,NORA LILIANA FIGUEROA HERNNDEZ,COBÁN,URBANA,OFICIAL,MONOLINGUE,VESPERTINA,DIARIO(REGULAR)
16-01-0583-46,16-031,ALTA VERAPAZ,COBAN,COLEGIO NUEVOS SENDEROS,"3A. CALLE 3-74, ZONA 3",79417300,PATRICIO NAJARRO ASENCIO,ZOYLA ARGENTINA MOLLINEDO ALVARADO,DIVERSIFICADO,PRIVADO,URBANA,ABIERTA,MONOLINGUE,MATUTINA,DIARIO(REGULAR),ALTA VERAPAZ,alta_verapaz,COLEGIO NUEVOS SENDEROS,"3A. CALLE 3-74, ZONA 3",79417300,ZOYLA ARGENTINA MOLLINEDO ALVARADO,PATRICIO NAJARRO ASENCIO,COBÁN,URBANA,PRIVADO,MONOLINGUE,MATUTINA,DIARIO(REGULAR)
16-01-0604-46,16-031,ALTA VERAPAZ,COBAN,INSTITUTO PRIVADO RAUL CHENAL HEINEMANN,"5A. CALLE 1-06, ZONA 3",79510413,PATRICIO NAJARRO ASENCIO,SILVIA BEATRIZ SOTO CHɎ,DIVERSIFICADO,PRIVADO,URBANA,ABIERTA,MONOLINGUE,MATUTINA,DIARIO(REGULAR),ALTA VERAPAZ,alta_verapaz,INSTITUTO PRIVADO RAUL CHENAL HEINEMANN,"5A. CALLE 1-06, ZONA 3",79510413,SILVIA BEATRIZ SOTO CHɎ,PATRICIO NAJARRO ASENCIO,COBÁN,URBANA,PRIVADO,MONOLINGUE,MATUTINA,DIARIO(REGULAR)
16-01-0609-46,16-031,ALTA VERAPAZ,COBAN,INSTITUTO MIXTO DE EDUCACION BILINGUE INTERCULTURAL -IMEBI-,LOTIFICACION CHIVENCORRAL,30367501,PATRICIO NAJARRO ASENCIO,JUAN PASCUAL LUCAS ANTONIO,DIVERSIFICADO,PRIVADO,URBANA,ABIERTA,MONOLINGUE,VESPERTINA,DIARIO(REGULAR),ALTA VERAPAZ,alta_verapaz,INSTITUTO MIXTO DE EDUCACION BILINGUE INTERCULTURAL -IMEBI-,LOTIFICACION CHIVENCORRAL,30367501,JUAN PASCUAL LUCAS ANTONIO,PATRICIO NAJARRO ASENCIO,COBÁN,URBANA,PRIVADO,MONOLINGUE,VESPERTINA,DIARIO(REGULAR)
16-01-0612-46,16-031,ALTA VERAPAZ,COBAN,INSTITUTO DE MAGISTERIO DE EDUCACION PREPRIMARIA INFANTIL BILINGUE INTERCULTURAL LUZ DEL SABER,"CALZADA RABIN AJAU, ZONA 1",57565646,PATRICIO NAJARRO ASENCIO,THELMA MARTINA POP TZIR,DIVERSIFICADO,PRIVADO,RURAL,ABIERTA,BILINGUE,VESPERTINA,DIARIO(REGULAR),ALTA VERAPAZ,alta_verapaz,INSTITUTO DE MAGISTERIO DE EDUCACION PREPRIMARIA INFANTIL BILINGUE INTERCULTURAL LUZ DEL SABER,"CALZADA RABIN AJAU, ZONA 1",57565646,THELMA MARTINA POP TZIR,PATRICIO NAJARRO ASENCIO,COBÁN,RURAL,PRIVADO,BILINGUE,VESPERTINA,DIARIO(REGULAR)
16-01-0613-46,16-031,ALTA VERAPAZ,COBAN,"COLEGIO PARTICULAR MIXTO ""ANTON DE MONTESINOS""",1A. CALLE 7-22 ZONA 3,77259205,PATRICIO NAJARRO ASENCIO,MARGARITA VILLALOBOS LIGORŔ,DIVERSIFICADO,PRIVADO,URBANA,ABIERTA,MONOLINGUE,MATUTINA,DIARIO(REGULAR),ALTA VERAPAZ,alta_verapaz,COLEGIO PARTICULAR MIXTO ANTON DE MONTESINOS,1A. CALLE 7-22 ZONA 3,77259205,MARGARITA VILLALOBOS LIGORR,PATRICIO NAJARRO ASENCIO,COBÁN,URBANA,PRIVADO,MONOLINGUE,MATUTINA,DIARIO(REGULAR)
16-01-0616-46,16-037,ALTA VERAPAZ,COBAN,INSTITUTO NACIONAL DE EDUCACION DIVERSIFICADA,ALDEA SALACUIM,57655184,CESAR RIGOBERTO CUC CAAL,AXEL ABELARDO CHUB LEAL,DIVERSIFICADO,OFICIAL,RURAL,ABIERTA,MONOLINGUE,VESPERTINA,DIARIO(REGULAR),ALTA VERAPAZ,alta_verapaz,INSTITUTO NACIONAL DE EDUCACION DIVERSIFICADA,ALDEA SALACUIM,57655184,AXEL ABELARDO CHUB LEAL,CESAR RIGOBERTO CUC CAAL,COBÁN,RURAL,OFICIAL,MONOLINGUE,VESPERTINA,DIARIO(REGULAR)
16-01-0642-46,16-005,ALTA VERAPAZ,COBAN,INSTITUTO NACIONAL DE EDUCACION DIVERSIFICADA,ALDEA CHOVAL,53331646,NORA LILIANA FIGUEROA HERNNDEZ,GILDA ARACELY WELLMANN DUARTE,DIVERSIFICADO,OFICIAL,RURAL,ABIERTA,MONOLINGUE,VESPERTINA,DIARIO(REGULAR),ALTA VERAPAZ,alta_verapaz,INSTITUTO NACIONAL DE EDUCACION DIVERSIFICADA,ALDEA CHOVAL,53331646,GILDA ARACELY WELLMANN DUARTE,NORA LILIANA FIGUEROA HERNNDEZ,COBÁN,RURAL,OFICIAL,MONOLINGUE,VESPERTINA,DIARIO(REGULAR)
16-01-0651-46,16-031,ALTA VERAPAZ,COBAN,CENTRO DE FORMACIӎ INTEGRAL CIUDAD DE LA ESPERANZA,6A. AV. 10-68 ZONA 12 COLONIA EL ESFUERZO I,77367652,PATRICIO NAJARRO ASENCIO,BYRON ANIBAL GӍEZ GATICA,DIVERSIFICADO,PRIVADO,URBANA,ABIERTA,MONOLINGUE,MATUTINA,DIARIO(REGULAR),ALTA VERAPAZ,alta_verapaz,CENTRO DE FORMACIӍ INTEGRAL CIUDAD DE LA ESPERANZA,6A. AVENIDA. 10-68 ZONA 12 COLONIA EL ESFUERZO I,77367652,BYRON ANIBAL GӍEZ GATICA,PATRICIO NAJARRO ASENCIO,COBÁN,URBANA,PRIVADO,MONOLINGUE,MATUTINA,DIARIO(REGULAR)
16-01-0652-46,16-037,ALTA VERAPAZ,COBAN,INSTITUTO MAYA COMUNITARIO K'AMOLB'E,ALDEA NIMLAJACOC,30621374,CESAR RIGOBERTO CUC CAAL,JOSE LINO QUIB CHE,DIVERSIFICADO,PRIVADO,RURAL,ABIERTA,BILINGUE,VESPERTINA,DIARIO(REGULAR),ALTA VERAPAZ,alta_verapaz,INSTITUTO MAYA COMUNITARIO KAMOLBE,ALDEA NIMLAJACOC,30621374,JOSE LINO QUIB CHE,CESAR RIGOBERTO CUC CAAL,COBÁN,RURAL,PRIVADO,BILINGUE,VESPERTINA,DIARIO(REGULAR)
16-01-0664-46,16-031,ALTA VERAPAZ,COBAN,LICEO AMERICANO DEL NORTE,5TA. AVENIDA 2-23 ZONA 4,79514754,PATRICIO NAJARRO ASENCIO,JOSɠCUPERTINO REYES GARCIA,DIVERSIFICADO,PRIVADO,URBANA,ABIERTA,MONOLINGUE,MATUTINA,DIARIO(REGULAR),ALTA VERAPAZ,alta_verapaz,LICEO AMERICANO DEL NORTE,5TA. AVENIDA 2-23 ZONA 4,79514754,JOSƓCUPERTINO REYES GARCIA,PATRICIO NAJARRO ASENCIO,COBÁN,URBANA,PRIVADO,MONOLINGUE,MATUTINA,DIARIO(REGULAR)
16-01-0668-46,16-031,ALTA VERAPAZ,COBAN,COLEGIO PARTICULAR MIXTO IMPERIAL,"5A CALLE 1-98, ZONA 3",57101061,PATRICIO NAJARRO ASENCIO,SUSELY BEATRIZ EĹS POP,DIVERSIFICADO,PRIVADO,URBANA,ABIERTA,MONOLINGUE,DOBLE,DIARIO(REGULAR),ALTA VERAPAZ,alta_verapaz,COLEGIO PARTICULAR MIXTO IMPERIAL,"5A CALLE 1-98, ZONA 3",57101061,SUSELY BEATRIZ ELS POP,PATRICIO NAJARRO ASENCIO,COBÁN,URBANA,PRIVADO,MONOLINGUE,DOBLE,DIARIO(REGULAR)
16-01-0671-46,16-031,ALTA VERAPAZ,COBAN,COLEGIO PRIVADO MIXTO TECNOLӇICO EN INFORMTICA,2A. CALLE 12-23 ZONA 4,79521190,PATRICIO NAJARRO ASENCIO,JORGE SALVADOR JUREZ SIERRA,DIVERSIFICADO,PRIVADO,URBANA,ABIERTA,MONOLINGUE,DOBLE,DIARIO(REGULAR),ALTA VERAPAZ,alta_verapaz,COLEGIO PRIVADO MIXTO TECNOLOGICO EN INFORMATICA,2A. CALLE 12-23 ZONA 4,79521190,JORGE SALVADOR JUREZ SIERRA,PATRICIO NAJARRO ASENCIO,COBÁN,URBANA,PRIVADO,MONOLINGUE,DOBLE,DIARIO(REGULAR)
16-01-0672-46,16-031,ALTA VERAPAZ,COBAN,ICA,11AVENIDA 1-10 ZONA 1,33509500,PATRICIO NAJARRO ASENCIO,LAIDY ANDREA CHOCOOJ TIUL,DIVERSIFICADO,PRIVADO,URBANA,ABIERTA,MONOLINGUE,MATUTINA,DIARIO(REGULAR),ALTA VERAPAZ,alta_verapaz,ICA,11AVENIDA 1-10 ZONA 1,33509500,LAIDY ANDREA CHOCOOJ TIUL,PATRICIO NAJARRO ASENCIO,COBÁN,URBANA,PRIVADO,MONOLINGUE,MATUTINA,DIARIO(REGULAR)
16-01-0678-46,16-031,ALTA VERAPAZ,COBAN,COLEGIO LA LIBERTAD,3A. AVENIDA CINCO GUION DOCE (5-12),48979726,PATRICIO NAJARRO ASENCIO,SILVIA YOLANDA CAAL QUIM,DIVERSIFICADO,PRIVADO,URBANA,ABIERTA,MONOLINGUE,DOBLE,FIN DE SEMANA,ALTA VERAPAZ,alta_verapaz,COLEGIO LA LIBERTAD,3A. AVENIDA CINCO GUION DOCE (5-12),48979726,SILVIA YOLANDA CAAL QUIM,PATRICIO NAJARRO ASENCIO,COBÁN,URBANA,PRIVADO,MONOLINGUE,DOBLE,FIN DE SEMANA
16-01-0681-46,16-031,ALTA VERAPAZ,COBAN,INSTITUTO MIXTO PRIVADO SANTO DOMINGO,"2A. CALLE 11-10, ZONA 2",79529830,PATRICIO NAJARRO ASENCIO,AMɒICA NUILA LUTHER,DIVERSIFICADO,PRIVADO,URBANA,ABIERTA,MONOLINGUE,DOBLE,FIN DE SEMANA,ALTA VERAPAZ,alta_verapaz,INSTITUTO MIXTO PRIVADO LATINO,"2A. CALLE 11-10, ZONA 2",79529830,AMⱰICA NUILA LUTHER,PATRICIO NAJARRO ASENCIO,COBÁN,URBANA,PRIVADO,MONOLINGUE,DOBLE,FIN DE SEMANA
16-01-0690-46,16-031,ALTA VERAPAZ,COBAN,"ISEA ""LA ESCUELA EN SU CASA""",1A. AV. 4-24 ZONA 2,77930803,PATRICIO NAJARRO ASENCIO,LUDWING JOEL NORIEGA MORALES,DIVERSIFICADO,PRIVADO,URBANA,ABIERTA,MONOLINGUE,DOBLE,A DISTANCIA,ALTA VERAPAZ,alta_verapaz,ISEA LA ESCUELA EN SU CASA,1A. AVENIDA. 4-24 ZONA 2,77930803,LUDWING JOEL NORIEGA MORALES,PATRICIO NAJARRO ASENCIO,COBÁN,URBANA,PRIVADO,MONOLINGUE,DOBLE,A DISTANCIA
16-01-0694-46,16-031,ALTA VERAPAZ,COBAN,COLEGIO LA LIBERTAD,3A. AV. 5-12 ZONA 4,55564568,PATRICIO NAJARRO ASENCIO,SILVIA YOLANDA CAAL QUIM,DIVERSIFICADO,PRIVADO,URBANA,ABIERTA,MONOLINGUE,DOBLE,SEMIPRESENCIAL,ALTA VERAPAZ,alta_verapaz,COLEGIO LA LIBERTAD,3A. AVENIDA. 5-12 ZONA 4,55564568,SILVIA YOLANDA CAAL QUIM,PATRICIO NAJARRO ASENCIO,COBÁN,URBANA,PRIVADO,MONOLINGUE,DOBLE,SEMIPRESENCIAL
16-01-0703-46,16-031,ALTA VERAPAZ,COBAN,INSTITUTO MIXTO PRIVADO SALUD Y DESARROLLO,DIAGNONAL 1 1-26 ZONA 1,51922050,PATRICIO NAJARRO ASENCIO,SAMANTHA GABRIELA DE LA CRUZ MORALES,DIVERSIFICADO,PRIVADO,URBANA,ABIERTA,BILINGUE,VESPERTINA,DIARIO(REGULAR),ALTA VERAPAZ,alta_verapaz,INSTITUTO MIXTO PRIVADO SALUD Y DESARROLLO,DIAGNONAL 1 1-26 ZONA 1,51922050,SAMANTHA GABRIELA DE LA CRUZ MORALES,PATRICIO NAJARRO ASENCIO,COBÁN,URBANA,PRIVADO,BILINGUE,VESPERTINA,DIARIO(REGULAR)
16-01-0705-46,16-050,ALTA VERAPAZ,COBAN,PROGRAMA NACIONAL DE EDUCACIӎ ALTERNATIVA PRONEA,7A. AV. 2-18 D ZONA 1,45587767,MAXIMILIANO CHUB ICAL,--,DIVERSIFICADO,OFICIAL,RURAL,ABIERTA,MONOLINGUE,DOBLE,A DISTANCIA,ALTA VERAPAZ,alta_verapaz,PROGRAMA NACIONAL DE EDUCACIӍ ALTERNATIVA PRONEA,7A. AVENIDA. 2-18 D ZONA 1,45587767,--,MAXIMILIANO CHUB ICAL,COBÁN,RURAL,OFICIAL,MONOLINGUE,DOBLE,A DISTANCIA
16-01-0710-46,16-031,ALTA VERAPAZ,COBAN,OXFORD BILINGUAL SCHOOL,2DA. CALLE 16-94 ZONA 4,79513898,PATRICIO NAJARRO ASENCIO,DARWIN ROBERTO IGLESIAS DE LA CRUZ,DIVERSIFICADO,PRIVADO,URBANA,ABIERTA,BILINGUE,MATUTINA,DIARIO(REGULAR),ALTA VERAPAZ,alta_verapaz,OXFORD BILINGUAL SCHOOL,2DA. CALLE 16-94 ZONA 4,79513898,DARWIN ROBERTO IGLESIAS DE LA CRUZ,PATRICIO NAJARRO ASENCIO,COBÁN,URBANA,PRIVADO,BILINGUE,MATUTINA,DIARIO(REGULAR)
16-01-0712-46,16-050,ALTA VERAPAZ,COBAN,ENBI CENTRO DE EDUCACIӎ EXTRAESCOLAR -CEEX-,10 AVENIDA 1-25 ZONA 3,79521302,MAXIMILIANO CHUB ICAL,ANABELA CECILIA BOL CAAL,DIVERSIFICADO,OFICIAL,URBANA,ABIERTA,BILINGUE,VESPERTINA,DIARIO(REGULAR),ALTA VERAPAZ,alta_verapaz,CENTRO DE EDUCACIӍ EXTRAESCOLAR -CEEX-,10 AVENIDA 1-25 ZONA 3,79521302,ANABELA CECILIA BOL CAAL,MAXIMILIANO CHUB ICAL,COBÁN,URBANA,OFICIAL,BILINGUE,VESPERTINA,DIARIO(REGULAR)
16-01-0909-46,16-031,ALTA VERAPAZ,COBAN,"ISEA ""LA ESCUELA EN SU CASA""","2A. CALLE ""A"" 11-10, ZONA 1",77256954,PATRICIO NAJARRO ASENCIO,LUDWING JOEL NORIEGA MORALES,DIVERSIFICADO,PRIVADO,URBANA,ABIERTA,MONOLINGUE,SIN JORNADA,SEMIPRESENCIAL (FIN DE SEMANA),ALTA VERAPAZ,alta_verapaz,ISEA LA ESCUELA EN SU CASA,"2A. CALLE A 11-10, ZONA 1",77256954,LUDWING JOEL NORIEGA MORALES,PATRICIO NAJARRO ASENCIO,COBÁN,URBANA,PRIVADO,MONOLINGUE,SIN JORNADA,SEMIPRESENCIAL (FIN DE SEMANA)
16-01-0910-46,16-031,ALTA VERAPAZ,COBAN,COLEGIO DE INFORMATICA CENINFAV,"12 AVENIDA 2-12, ZONA 1",79521765,PATRICIO NAJARRO ASENCIO,HɃTOR VIDAL BOL Cڼ/td>,DIVERSIFICADO,PRIVADO,URBANA,ABIERTA,MONOLINGUE,SIN JORNADA,SEMIPRESENCIAL (FIN DE SEMANA),ALTA VERAPAZ,alta_verapaz,COLEGIO DE INFORMATICA CENINFAV,"12 AVENIDA 2-12, ZONA 1",79521765,HɃTOR VIDAL BOL CڼTD,PATRICIO NAJARRO ASENCIO,COBÁN,URBANA,PRIVADO,MONOLINGUE,SIN JORNADA,SEMIPRESENCIAL (FIN DE SEMANA)
16-01-0912-46,16-031,ALTA VERAPAZ,COBAN,COLEGIO PRIVADO MIXTO TECNOLOGICO EN INFORMATICA,"2A. CALLE 12-23, ZONA 4",79511459,PATRICIO NAJARRO ASENCIO,DANIEL BERNARDO RAMIREZ GONZLEZ,DIVERSIFICADO,PRIVADO,URBANA,ABIERTA,MONOLINGUE,SIN JORNADA,SEMIPRESENCIAL (FIN DE SEMANA),ALTA VERAPAZ,alta_verapaz,COLEGIO PRIVADO MIXTO TECNOLOGICO EN INFORMATICA,"2A. CALLE 12-23, ZONA 4",79511459,DANIEL BERNARDO RAMIREZ GONZLEZ,PATRICIO NAJARRO ASENCIO,COBÁN,URBANA,PRIVADO,MONOLINGUE,SIN JORNADA,SEMIPRESENCIAL (FIN DE SEMANA)
16-01-0913-46,16-031,ALTA VERAPAZ,COBAN,INSTITUTO MIXTO PRIVADO SALUD Y DESARROLLO,"DIAGONAL 1 1-26, ZONA 1",59584790,PATRICIO NAJARRO ASENCIO,SAMANTHA GABRIELA DE LA CRUZ MORALES,DIVERSIFICADO,PRIVADO,URBANA,ABIERTA,MONOLINGUE,SIN JORNADA,SEMIPRESENCIAL (FIN DE SEMANA),ALTA VERAPAZ,alta_verapaz,INSTITUTO MIXTO PRIVADO SALUD Y DESARROLLO,"DIAGONAL 1 1-26, ZONA 1",59584790,SAMANTHA GABRIELA DE LA CRUZ MORALES,PATRICIO NAJARRO ASENCIO,COBÁN,URBANA,PRIVADO,MONOLINGUE,SIN JORNADA,SEMIPRESENCIAL (FIN DE SEMANA)
16-01-0915-46,16-031,ALTA VERAPAZ,COBAN,INSTITUTO MIXTO PRIVADO SANTO DOMINGO,"2A. CALLE 11-10, ZONA 2",79529830,PATRICIO NAJARRO ASENCIO,AMɒICA NUILA LUTHER,DIVERSIFICADO,PRIVADO,URBANA,ABIERTA,MONOLINGUE,SIN JORNADA,SEMIPRESENCIAL (FIN DE SEMANA),ALTA VERAPAZ,alta_verapaz,INSTITUTO MIXTO PRIVADO LATINO,"2A. CALLE 11-10, ZONA 2",79529830,AMⱰICA NUILA LUTHER,PATRICIO NAJARRO ASENCIO,COBÁN,URBANA,PRIVADO,MONOLINGUE,SIN JORNADA,SEMIPRESENCIAL (FIN DE SEMANA)
16-01-0917-46,16-031,ALTA VERAPAZ,COBAN,INSTITUTO PRIVADO MIXTO MONJA BLANCA,"DIAGONAL 3 14-11, ZONA 2",79513896,PATRICIO NAJARRO ASENCIO,EDWIN ARMANDO CATڎ CAAL,DIVERSIFICADO,PRIVADO,URBANA,ABIERTA,MONOLINGUE,SIN JORNADA,SEMIPRESENCIAL (FIN DE SEMANA),ALTA VERAPAZ,alta_verapaz,INSTITUTO PRIVADO MIXTO MALACATECO,"DIAGONAL 3 14-11, ZONA 2",79513896,EDWIN ARMANDO CATڎ CAAL,PATRICIO NAJARRO ASENCIO,COBÁN,URBANA,PRIVADO,MONOLINGUE,SIN JORNADA,SEMIPRESENCIAL (FIN DE SEMANA)
16-01-0918-46,16-031,ALTA VERAPAZ,COBAN,LICEO PREUNIVERSITARIO DE NORTE,"3A. AVENIDA 8-32, ZONA 10",79417346,PATRICIO NAJARRO ASENCIO,ZOILA IMENA LӐEZ RODAS,DIVERSIFICADO,PRIVADO,URBANA,ABIERTA,MONOLINGUE,SIN JORNADA,SEMIPRESENCIAL (FIN DE SEMANA),ALTA VERAPAZ,alta_verapaz,LICEO PREUNIVERSITARIO DEL SUR.,"3A. AVENIDA 8-32, ZONA 10",79417346,ZOILA IMENA LӐEZ RODAS,PATRICIO NAJARRO ASENCIO,COBÁN,URBANA,PRIVADO,MONOLINGUE,SIN JORNADA,SEMIPRESENCIAL (FIN DE SEMANA)
16-01-0919-46,16-031,ALTA VERAPAZ,COBAN,"LICEO MIXTO PARTICULAR ""SAN BENITO""","9A. AVENIDA 4-55, ZONA 4",37058145,PATRICIO NAJARRO ASENCIO,HENRI MARCO ARTOLA TEYUL,DIVERSIFICADO,PRIVADO,URBANA,ABIERTA,MONOLINGUE,VESPERTINA,DIARIO(REGULAR),ALTA VERAPAZ,alta_verapaz,LICEO MIXTO PARTICULAR SAN BENITO,"9A. AVENIDA 4-55, ZONA 4",37058145,HENRI MARCO ARTOLA TEYUL,PATRICIO NAJARRO ASENCIO,COBÁN,URBANA,PRIVADO,MONOLINGUE,VESPERTINA,DIARIO(REGULAR)
16-01-0922-46,16-031,ALTA VERAPAZ,COBAN,COLEGIO LA LIBERTAD,"3A. AVENIDA 5-12, ZONA 4",33857209,PATRICIO NAJARRO ASENCIO,SILVIA YOLANDA CAAL QUIM,DIVERSIFICADO,PRIVADO,URBANA,ABIERTA,MONOLINGUE,SIN JORNADA,SEMIPRESENCIAL (FIN DE SEMANA),ALTA VERAPAZ,alta_verapaz,COLEGIO LA LIBERTAD,"3A. AVENIDA 5-12, ZONA 4",33857209,SILVIA YOLANDA CAAL QUIM,PATRICIO NAJARRO ASENCIO,COBÁN,URBANA,PRIVADO,MONOLINGUE,SIN JORNADA,SEMIPRESENCIAL (FIN DE SEMANA)
16-01-0926-46,16-005,ALTA VERAPAZ,COBAN,INSTITUTO NACIONAL DE EDUCACIӎ DIVERSIFICADA,2A. CALLE 1-99 ZONA 4 COBAN,33622052,NORA LILIANA FIGUEROA HERNNDEZ,SELVIN EDDER HERNNDEZ MOLINA,DIVERSIFICADO,OFICIAL,URBANA,ABIERTA,MONOLINGUE,NOCTURNA,DIARIO(REGULAR),ALTA VERAPAZ,alta_verapaz,INSTITUTO NACIONAL DE EDUCACION DIVERSIFICADA,2A. CALLE 1-99 ZONA 4 COBAN,33622052,SELVIN EDDER HERNNDEZ MOLINA,NORA LILIANA FIGUEROA HERNNDEZ,COBÁN,URBANA,OFICIAL,MONOLINGUE,NOCTURNA,DIARIO(REGULAR)
16-01-0927-46,16-005,ALTA VERAPAZ,COBAN,INSTITUTO NACIONAL DE EDUCACIӎ DIVERSIFICADA,2A. CALLE 1-99 ZONA 4,33622052,NORA LILIANA FIGUEROA HERNNDEZ,SELVIN EDDER HERNNDEZ MOLINA,DIVERSIFICADO,OFICIAL,URBANA,ABIERTA,MONOLINGUE,NOCTURNA,DIARIO(REGULAR),ALTA VERAPAZ,alta_verapaz,INSTITUTO NACIONAL DE EDUCACION DIVERSIFICADA,2A. CALLE 1-99 ZONA 4,33622052,SELVIN EDDER HERNNDEZ MOLINA,NORA LILIANA FIGUEROA HERNNDEZ,COBÁN,URBANA,OFICIAL,MONOLINGUE,NOCTURNA,DIARIO(REGULAR)
16-01-0986-46,16-031,ALTA VERAPAZ,COBAN,COLEGIO MIXTO LA EXCELENCIA,"2A. CALLE 8-18 ZONA 4, COBAN",41114848,PATRICIO NAJARRO ASENCIO,ZULY BEATRIZ LӐEZ WINTER,DIVERSIFICADO,PRIVADO,URBANA,ABIERTA,MONOLINGUE,DOBLE,FIN DE SEMANA,ALTA VERAPAZ,alta_verapaz,COLEGIO MIXTO LA EXCELENCIA,"2A. CALLE 8-18 ZONA 4, COBAN",41114848,ZULY BEATRIZ LӐEZ WINTER,PATRICIO NAJARRO ASENCIO,COBÁN,URBANA,PRIVADO,MONOLINGUE,DOBLE,FIN DE SEMANA
16-01-0987-46,16-031,ALTA VERAPAZ,COBAN,COLEGIO MIXTO LA EXCELENCIA,"2A. CALLE 8-18 ZONA 4, COBAN",41114848,PATRICIO NAJARRO ASENCIO,ZULY BEATRIZ LӐEZ WINTER,DIVERSIFICADO,PRIVADO,URBANA,ABIERTA,MONOLINGUE,SIN JORNADA,SEMIPRESENCIAL (FIN DE SEMANA),ALTA VERAPAZ,alta_verapaz,COLEGIO MIXTO LA EXCELENCIA,"2A. CALLE 8-18 ZONA 4, COBAN",41114848,ZULY BEATRIZ LӐEZ WINTER,PATRICIO NAJARRO ASENCIO,COBÁN,URBANA,PRIVADO,MONOLINGUE,SIN JORNADA,SEMIPRESENCIAL (FIN DE SEMANA)
16-01-0990-46,16-031,ALTA VERAPAZ,COBAN,"LICEO MIXTO PARTICULAR ""SAN BENITO""","9A. AVENIDA 4-55, ZONA 4",37058145,PATRICIO NAJARRO ASENCIO,HENRI MARCO ARTOLA TEYUL,DIVERSIFICADO,PRIVADO,URBANA,ABIERTA,MONOLINGUE,SIN JORNADA,SEMIPRESENCIAL (UN D́ A LA SEMANA),ALTA VERAPAZ,alta_verapaz,LICEO MIXTO PARTICULAR SAN BENITO,"9A. AVENIDA 4-55, ZONA 4",37058145,HENRI MARCO ARTOLA TEYUL,PATRICIO NAJARRO ASENCIO,COBÁN,URBANA,PRIVADO,MONOLINGUE,SIN JORNADA,SEMIPRESENCIAL (UN D A LA SEMANA)
16-01-0991-46,16-031,ALTA VERAPAZ,COBAN,"LICEO MIXTO PARTICULAR ""SAN BENITO""","9A. AVENIDA 4-55, ZONA 4",37058145,PATRICIO NAJARRO ASENCIO,HENRI MARCO ARTOLA TEYUL,DIVERSIFICADO,PRIVADO,URBANA,ABIERTA,MONOLINGUE,DOBLE,FIN DE SEMANA,ALTA VERAPAZ,alta_verapaz,LICEO MIXTO PARTICULAR SAN BENITO,"9A. AVENIDA 4-55, ZONA 4",37058145,HENRI MARCO ARTOLA TEYUL,PATRICIO NAJARRO ASENCIO,COBÁN,URBANA,PRIVADO,MONOLINGUE,DOBLE,FIN DE SEMANA
16-01-0994-46,16-050,ALTA VERAPAZ,COBAN,CENTRO DE EDUCACIӎ EXTRAESCOLAR -CEEX-,BARRIO CHIVENCORRAL ZONA 12,49972934,MAXIMILIANO CHUB ICAL,HENRRY ALEXANDER DE LOS SANTOS MUTZ,DIVERSIFICADO,OFICIAL,URBANA,ABIERTA,MONOLINGUE,DOBLE,DIARIO(REGULAR),ALTA VERAPAZ,alta_verapaz,CENTRO DE EDUCACIӍ EXTRAESCOLAR -CEEX-,BARRIO CHIVENCORRAL ZONA 12,49972934,HENRRY ALEXANDER DE LOS SANTOS MUTZ,MAXIMILIANO CHUB ICAL,COBÁN,URBANA,OFICIAL,MONOLINGUE,DOBLE,DIARIO(REGULAR)
