CODIGO,DISTRITO,DEPARTAMENTO,MUNICIPIO,ESTABLECIMIENTO,DIRECCION,TELEFONO,SUPERVISOR,DIRECTOR,NIVEL,SECTOR,AREA,STATUS,MODALIDAD,JORNADA,PLAN,DEPARTAMENTAL,ARCHIVO_ORIGEN,ESTABLECIMIENTO_LIMPIO,DIRECCION_LIMPIA,TELEFONO_LIMPIO,DIRECTOR_LIMPIO,SUPERVISOR_LIMPIO,MUNICIPIO_LIMPIO,AREA_LIMPIO,SECTOR_LIMPIO,MODALIDAD_LIMPIO,JORNADA_LIMPIO,PLAN_LIMPIO
16-01-0997-46,16-004,ALTA VERAPAZ,COBAN,CENTRO EDUCATIVO BETANIA,SAN BENITO I,42183442,AQUILES GIOVANI BAC GUEVARA,SANDRA JULIETA PɒEZ RAMOS,DIVERSIFICADO,PRIVADO,RURAL,ABIERTA,MONOLINGUE,VESPERTINA,DIARIO(REGULAR),ALTA VERAPAZ,alta_verapaz,CENTRO EDUCATIVO BANAPORT,SAN BENITO I,42183442,SANDRA JULIETA PⱰEZ RAMOS,AQUILES GIOVANI BAC GUEVARA,COBÁN,RURAL,PRIVADO,MONOLINGUE,VESPERTINA,DIARIO(REGULAR)
16-01-1001-46,16-031,ALTA VERAPAZ,COBAN,LICEO DR. RICARDO BRESSANI,1A. AVENIDA 5-56 ZONA 2,79521633,PATRICIO NAJARRO ASENCIO,BELSY CLARIBEL SANTISTEBAN ARCHILA,DIVERSIFICADO,PRIVADO,URBANA,ABIERTA,MONOLINGUE,DOBLE,VIRTUAL A DISTANCIA,ALTA VERAPAZ,alta_verapaz,LICEO DR. RICARDO BRESSANI,1A. AVENIDA 5-56 ZONA 2,79521633,BELSY CLARIBEL SANTISTEBAN ARCHILA,PATRICIO NAJARRO ASENCIO,COBÁN,URBANA,PRIVADO,MONOLINGUE,DOBLE,VIRTUAL A DISTANCIA
16-01-1002-46,16-031,ALTA VERAPAZ,COBAN,COLEGIO CRISTIANO ELIM,"DIAGONAL 3, 11-04, ZONA 2",44779923,PATRICIO NAJARRO ASENCIO,SELVIN DARIO ROSALES AGUIRRE,DIVERSIFICADO,PRIVADO,URBANA,ABIERTA,MONOLINGUE,MATUTINA,DIARIO(REGULAR),ALTA VERAPAZ,alta_verapaz,COLEGIO CRISTIANO ELIM,"DIAGONAL 3, 11-04, ZONA 2",44779923,SELVIN DARIO ROSALES AGUIRRE,PATRICIO NAJARRO ASENCIO,COBÁN,URBANA,PRIVADO,MONOLINGUE,MATUTINA,DIARIO(REGULAR)
16-01-1005-46,16-031,ALTA VERAPAZ,COBAN,LICEO CHAAB'IL B'E,8A. AVENIDA 4-39 ZONA 4,56969292,PATRICIO NAJARRO ASENCIO,ALLAN NOEL MACZ CHIQUIN,DIVERSIFICADO,PRIVADO,URBANA,ABIERTA,MONOLINGUE,VESPERTINA,VIRTUAL A DISTANCIA,ALTA VERAPAZ,alta_verapaz,LICEO CHAABIL BE,8A. AVENIDA 4-39 ZONA 4,56969292,ALLAN NOEL MACZ CHIQUIN,PATRICIO NAJARRO ASENCIO,COBÁN,URBANA,PRIVADO,MONOLINGUE,VESPERTINA,VIRTUAL A DISTANCIA
16-01-1008-46,16-031,ALTA VERAPAZ,COBAN,COLEGIO HISPANOAMERICANO,9A. AVENIDA 2-22 ZONA 1,77738763,PATRICIO NAJARRO ASENCIO,OCTAVIO ISMAEL BATZ CHOC,DIVERSIFICADO,PRIVADO,URBANA,ABIERTA,MONOLINGUE,VESPERTINA,DIARIO(REGULAR),ALTA VERAPAZ,alta_verapaz,LICEO HISPANOAMERICANO,9A. AVENIDA 2-22 ZONA 1,77738763,OCTAVIO ISMAEL BATZ CHOC,PATRICIO NAJARRO ASENCIO,COBÁN,URBANA,PRIVADO,MONOLINGUE,VESPERTINA,DIARIO(REGULAR)
16-01-1009-46,16-031,ALTA VERAPAZ,COBAN,COLEGIO BILING܅ BET-LUZ,7A. CALLE 11-233 ZONA 6,45379823,PATRICIO NAJARRO ASENCIO,CELESTE LETICIA YAT MACZ,DIVERSIFICADO,PRIVADO,URBANA,ABIERTA,MONOLINGUE,MATUTINA,DIARIO(REGULAR),ALTA VERAPAZ,alta_verapaz,COLEGIO BILING BET-LUZ,7A. CALLE 11-233 ZONA 6,45379823,CELESTE LETICIA YAT MACZ,PATRICIO NAJARRO ASENCIO,COBÁN,URBANA,PRIVADO,MONOLINGUE,MATUTINA,DIARIO(REGULAR)
16-01-1174-46,16-031,ALTA VERAPAZ,COBAN,INSTITUTO PRIVADO RAUL CHENAL HEINEMANN,5A. CALLE 1-06 ZONA 3,79510413,PATRICIO NAJARRO ASENCIO,SILVIA BEATRIZ SOTO CHɎ,DIVERSIFICADO,PRIVADO,URBANA,ABIERTA,MONOLINGUE,VESPERTINA,DIARIO(REGULAR),ALTA VERAPAZ,alta_verapaz,INSTITUTO PRIVADO RAUL CHENAL HEINEMANN,5A. CALLE 1-06 ZONA 3,79510413,SILVIA BEATRIZ SOTO CHɎ,PATRICIO NAJARRO ASENCIO,COBÁN,URBANA,PRIVADO,MONOLINGUE,VESPERTINA,DIARIO(REGULAR)
16-01-1175-46,16-031,ALTA VERAPAZ,COBAN,INSTITUTO PRIVADO RAUL CHENAL HEINEMANN,5TA. CALLE 1-06 ZONA 3,79520414,PATRICIO NAJARRO ASENCIO,SILVIA BEATRIZ SOTO CHɎ,DIVERSIFICADO,PRIVADO,URBANA,ABIERTA,MONOLINGUE,DOBLE,FIN DE SEMANA,ALTA VERAPAZ,alta_verapaz,INSTITUTO PRIVADO RAUL CHENAL HEINEMANN,5TA. CALLE 1-06 ZONA 3,79520414,SILVIA BEATRIZ SOTO CHɎ,PATRICIO NAJARRO ASENCIO,COBÁN,URBANA,PRIVADO,MONOLINGUE,DOBLE,FIN DE SEMANA
16-01-1394-46,16-031,ALTA VERAPAZ,COBAN,INSTITUTO PRIVADO MIXTO MONJA BLANCA,"DIAGONAL 3, 14-11 ZONA 2",79513896,PATRICIO NAJARRO ASENCIO,EDWIN ARMANDO CATڎ CAAL,DIVERSIFICADO,PRIVADO,URBANA,ABIERTA,MONOLINGUE,DOBLE,FIN DE SEMANA,ALTA VERAPAZ,alta_verapaz,INSTITUTO PRIVADO MIXTO MALACATECO,"DIAGONAL 3, 14-11 ZONA 2",79513896,EDWIN ARMANDO CATڎ CAAL,PATRICIO NAJARRO ASENCIO,COBÁN,URBANA,PRIVADO,MONOLINGUE,DOBLE,FIN DE SEMANA
16-01-1469-46,16-031,ALTA VERAPAZ,COBAN,COLEGIO PRIVADO MIXTO TECNOLOGICO EN INFORMATICA,2A. CALLE 12-23 ZONA 4,79511459,PATRICIO NAJARRO ASENCIO,DANIEL BERNARDO RAMIREZ GONZLEZ,DIVERSIFICADO,PRIVADO,URBANA,ABIERTA,MONOLINGUE,DOBLE,FIN DE SEMANA,ALTA VERAPAZ,alta_verapaz,COLEGIO PRIVADO MIXTO TECNOLOGICO EN INFORMATICA,2A. CALLE 12-23 ZONA 4,79511459,DANIEL BERNARDO RAMIREZ GONZLEZ,PATRICIO NAJARRO ASENCIO,COBÁN,URBANA,PRIVADO,MONOLINGUE,DOBLE,FIN DE SEMANA
16-01-2156-46,16-031,ALTA VERAPAZ,COBAN,COLEGIO PARTICULAR MIXTO IMPERIAL,5A. CALLE 1-98 ZONA 3,57101061,PATRICIO NAJARRO ASENCIO,FAREWELL LUTHER OSORIO,DIVERSIFICADO,PRIVADO,URBANA,ABIERTA,MONOLINGUE,VESPERTINA,DIARIO(REGULAR),ALTA VERAPAZ,alta_verapaz,COLEGIO PARTICULAR MIXTO IMPERIAL,5A. CALLE 1-98 ZONA 3,57101061,FAREWELL LUTHER OSORIO,PATRICIO NAJARRO ASENCIO,COBÁN,URBANA,PRIVADO,MONOLINGUE,VESPERTINA,DIARIO(REGULAR)
16-01-3041-46,16-005,ALTA VERAPAZ,COBAN,INSTITUTO DE BACHILLERATO ADS. AL INSTITUTO NORMAL MIXTO DEL NORTE EMILIO ROSALES PONCE,3AVENIDA 6-23 ZONA 11,79521468,NORA LILIANA FIGUEROA HERNNDEZ,VICTOR HUGO DOM͎GUEZ REYES,DIVERSIFICADO,OFICIAL,URBANA,ABIERTA,MONOLINGUE,VESPERTINA,DIARIO(REGULAR),ALTA VERAPAZ,alta_verapaz,INSTITUTO DE BACHILLERATO ADS. AL INSTITUTO NORMAL MIXTO DEL NORTE EMILIO ROSALES PONCE,3AVENIDA 6-23 ZONA 11,79521468,VICTOR HUGO DOMGUEZ REYES,NORA LILIANA FIGUEROA HERNNDEZ,COBÁN,URBANA,OFICIAL,MONOLINGUE,VESPERTINA,DIARIO(REGULAR)
16-01-6190-46,16-031,ALTA VERAPAZ,COBAN,LICEO MIGUEL ANGEL ASTURIAS,7A. CALLE 1-13 ZONA 3,79511103,PATRICIO NAJARRO ASENCIO,JAYRON ARIEL COY CACAO,DIVERSIFICADO,PRIVADO,URBANA,ABIERTA,MONOLINGUE,VESPERTINA,DIARIO(REGULAR),ALTA VERAPAZ,alta_verapaz,LICEO MIGUEL ANGEL ASTURIAS,7A. CALLE 1-13 ZONA 3,79511103,JAYRON ARIEL COY CACAO,PATRICIO NAJARRO ASENCIO,COBÁN,URBANA,PRIVADO,MONOLINGUE,VESPERTINA,DIARIO(REGULAR)
16-01-6191-46,16-031,ALTA VERAPAZ,COBAN,COLEGIO PRIVADO MIXTO TECNOLӇICO EN INFORMATICA,2A. CALLE 12-23 ZONA 4,79511459,PATRICIO NAJARRO ASENCIO,JORGE SALVADOR JUREZ SIERRA,DIVERSIFICADO,PRIVADO,URBANA,ABIERTA,MONOLINGUE,MATUTINA,DIARIO(REGULAR),ALTA VERAPAZ,alta_verapaz,COLEGIO PRIVADO MIXTO TECNOLOGICO EN INFORMATICA,2A. CALLE 12-23 ZONA 4,79511459,JORGE SALVADOR JUREZ SIERRA,PATRICIO NAJARRO ASENCIO,COBÁN,URBANA,PRIVADO,MONOLINGUE,MATUTINA,DIARIO(REGULAR)
16-01-8294-46,16-031,ALTA VERAPAZ,COBAN,LICEO PREUNIVERSITARIO DEL NORTE,3A. AVENIDA 8-32 BARRIO LA LIBERTAD ZONA 10,49745753,PATRICIO NAJARRO ASENCIO,OSCAR ALFREDO MOLINA Cڼ/td>,DIVERSIFICADO,PRIVADO,URBANA,ABIERTA,MONOLINGUE,DOBLE,DIARIO(REGULAR),ALTA VERAPAZ,alta_verapaz,LICEO PREUNIVERSITARIO DEL SUR.,3A. AVENIDA 8-32 BARRIO LA LIBERTAD ZONA 10,49745753,OSCAR ALFREDO MOLINA CڼTD,PATRICIO NAJARRO ASENCIO,COBÁN,URBANA,PRIVADO,MONOLINGUE,DOBLE,DIARIO(REGULAR)
16-01-8331-46,16-031,ALTA VERAPAZ,COBAN,LICEO PREUNIVERSITARIO DEL NORTE,3A. AVENIDA 8-32 BARRIO LA LIBERTAD ZONA 10,49745753,PATRICIO NAJARRO ASENCIO,ZOILA IMENA LӐEZ RODAS,DIVERSIFICADO,PRIVADO,URBANA,ABIERTA,MONOLINGUE,DOBLE,FIN DE SEMANA,ALTA VERAPAZ,alta_verapaz,LICEO PREUNIVERSITARIO DEL SUR.,3A. AVENIDA 8-32 BARRIO LA LIBERTAD ZONA 10,49745753,ZOILA IMENA LӐEZ RODAS,PATRICIO NAJARRO ASENCIO,COBÁN,URBANA,PRIVADO,MONOLINGUE,DOBLE,FIN DE SEMANA
16-01-8335-46,16-031,ALTA VERAPAZ,COBAN,COLEGIO DE INFORMATICA CENINFAV,12 AV. 2-12 ZONA 1,79545566,PATRICIO NAJARRO ASENCIO,MARIA MAGDALENA BOL CU,DIVERSIFICADO,PRIVADO,RURAL,ABIERTA,MONOLINGUE,MATUTINA,DIARIO(REGULAR),ALTA VERAPAZ,alta_verapaz,COLEGIO DE INFORMATICA CENINFAV,12 AVENIDA. 2-12 ZONA 1,79545566,MARIA MAGDALENA BOL CU,PATRICIO NAJARRO ASENCIO,COBÁN,RURAL,PRIVADO,MONOLINGUE,MATUTINA,DIARIO(REGULAR)
16-01-9067-46,16-005,ALTA VERAPAZ,COBAN,ESCUELA NORMAL DE EDUCACION FISICA,CALZADA RABIN AJAU ZONA 11,79523686,NORA LILIANA FIGUEROA HERNNDEZ,BERTA MARIA MENDEZ RODRIGUEZ,DIVERSIFICADO,OFICIAL,URBANA,ABIERTA,MONOLINGUE,DOBLE,DIARIO(REGULAR),ALTA VERAPAZ,alta_verapaz,ESCUELA NORMAL DE EDUCACION FISICA,CALZADA RABIN AJAU ZONA 11,79523686,BERTA MARIA MENDEZ RODRIGUEZ,NORA LILIANA FIGUEROA HERNNDEZ,COBÁN,URBANA,OFICIAL,MONOLINGUE,DOBLE,DIARIO(REGULAR)
16-01-9095-46,16-031,ALTA VERAPAZ,COBAN,COLEGIO PRIVADO MIXTO TECNOLOGICO EN INFORMATICA,2A. CALLE 12-23 ZONA 4,79511459,PATRICIO NAJARRO ASENCIO,DANIEL BERNARDO RAMIREZ GONZLEZ,DIVERSIFICADO,PRIVADO,URBANA,ABIERTA,MONOLINGUE,VESPERTINA,DIARIO(REGULAR),ALTA VERAPAZ,alta_verapaz,COLEGIO PRIVADO MIXTO TECNOLOGICO EN INFORMATICA,2A. CALLE 12-23 ZONA 4,79511459,DANIEL BERNARDO RAMIREZ GONZLEZ,PATRICIO NAJARRO ASENCIO,COBÁN,URBANA,PRIVADO,MONOLINGUE,VESPERTINA,DIARIO(REGULAR)
16-01-9102-46,16-031,ALTA VERAPAZ,COBAN,COLEGIO MIXTO EVANGELICO NAZARENO,6A. CALLE 8-10 ZONA 10 CERRITO EL CARACOL COBN,79511866,PATRICIO NAJARRO ASENCIO,ANA MARIA YAT COY,DIVERSIFICADO,PRIVADO,URBANA,ABIERTA,MONOLINGUE,MATUTINA,DIARIO(REGULAR),ALTA VERAPAZ,alta_verapaz,COLEGIO MIXTO EVANGELICO NAZARENO,6A. CALLE 8-10 ZONA 10 CERRITO EL CARACOL COBN,79511866,ANA MARIA YAT COY,PATRICIO NAJARRO ASENCIO,COBÁN,URBANA,PRIVADO,MONOLINGUE,MATUTINA,DIARIO(REGULAR)
16-01-9544-46,16-031,ALTA VERAPAZ,COBAN,COLEGIO BILINGUE DE INFANTES,3A. CALLE 7-07 ZONA 3,33836377,PATRICIO NAJARRO ASENCIO,NANCY JOHANA HENGSTENBERG DELGADO,DIVERSIFICADO,PRIVADO,URBANA,ABIERTA,MONOLINGUE,MATUTINA,DIARIO(REGULAR),ALTA VERAPAZ,alta_verapaz,COLEGIO BILINGUE DE INFANTES,3A. CALLE 7-07 ZONA 3,33836377,NANCY JOHANA HENGSTENBERG DELGADO,PATRICIO NAJARRO ASENCIO,COBÁN,URBANA,PRIVADO,MONOLINGUE,MATUTINA,DIARIO(REGULAR)
16-01-9851-46,16-031,ALTA VERAPAZ,COBAN,COLEGIO DE INFORMATICA CENINFAV,12AV. 2-12 ZONA 1,79521765,PATRICIO NAJARRO ASENCIO,HɃTOR VIDAL BOL Cڼ/td>,DIVERSIFICADO,PRIVADO,URBANA,ABIERTA,MONOLINGUE,DOBLE,FIN DE SEMANA,ALTA VERAPAZ,alta_verapaz,COLEGIO DE INFORMATICA CENINFAV,12AV. 2-12 ZONA 1,79521765,HɃTOR VIDAL BOL CڼTD,PATRICIO NAJARRO ASENCIO,COBÁN,URBANA,PRIVADO,MONOLINGUE,DOBLE,FIN DE SEMANA
16-01-9897-46,16-031,ALTA VERAPAZ,COBAN,COLEGIO PARTICULAR MIXTO VERAPAZ,KM.209.5 ENTRADA A COBAN,77367402,PATRICIO NAJARRO ASENCIO,JORGE EDY GUTIERREZ PONCE,DIVERSIFICADO,PRIVADO,URBANA,ABIERTA,MONOLINGUE,VESPERTINA,DIARIO(REGULAR),ALTA VERAPAZ,alta_verapaz,COLEGIO PARTICULAR MIXTO IMPERIAL,KILOMETRO.209.5 ENTRADA A COBAN,77367402,JORGE EDY GUTIERREZ PONCE,PATRICIO NAJARRO ASENCIO,COBÁN,URBANA,PRIVADO,MONOLINGUE,VESPERTINA,DIARIO(REGULAR)
16-01-9958-46,16-031,ALTA VERAPAZ,COBAN,LICEO DR. RICARDO BRESSANI,1A. AVENIDA 5-52 ZONA 2,79521920,PATRICIO NAJARRO ASENCIO,BELSY CLARIBEL SANTISTEBAN ARCHILA,DIVERSIFICADO,PRIVADO,URBANA,ABIERTA,MONOLINGUE,DOBLE,DIARIO(REGULAR),ALTA VERAPAZ,alta_verapaz,LICEO DR. RICARDO BRESSANI,1A. AVENIDA 5-52 ZONA 2,79521920,BELSY CLARIBEL SANTISTEBAN ARCHILA,PATRICIO NAJARRO ASENCIO,COBÁN,URBANA,PRIVADO,MONOLINGUE,DOBLE,DIARIO(REGULAR)
16-02-0013-46,16-006,ALTA VERAPAZ,SANTA CRUZ VERAPAZ,INSTITUTO NACIONAL DE EDUCACION DIVERSIFICADA,BARRIO SANTA ELENA,57767683,JORGE EDUARDO PAQUE LZARO,ERIK ROBERTO CڠPOP,DIVERSIFICADO,OFICIAL,RURAL,ABIERTA,MONOLINGUE,VESPERTINA,DIARIO(REGULAR),ALTA VERAPAZ,alta_verapaz,INSTITUTO NACIONAL DE EDUCACION DIVERSIFICADA,BARRIO SANTA ELENA,57767683,ERIK ROBERTO CڠPOP,JORGE EDUARDO PAQUE LZARO,SANTA CRUZ VERAPAZ,RURAL,OFICIAL,MONOLINGUE,VESPERTINA,DIARIO(REGULAR)
16-02-0020-46,16-006,ALTA VERAPAZ,SANTA CRUZ VERAPAZ,LICEO SANTA CRUZ,"CALLE 3 DE MAYO 2-67 ZONA 2, BARRIO SANTO TOMAS",50161328,JORGE EDUARDO PAQUE LZARO,AUGUSTO ALEXANDER RAX RODR͇UEZ,DIVERSIFICADO,PRIVADO,URBANA,ABIERTA,MONOLINGUE,VESPERTINA,DIARIO(REGULAR),ALTA VERAPAZ,alta_verapaz,LICEO SANTA CRUZ,"CALLE 3 DE MAYO 2-67 ZONA 2, BARRIO SANTO TOMAS",50161328,AUGUSTO ALEXANDER RAX RODRUEZ,JORGE EDUARDO PAQUE LZARO,SANTA CRUZ VERAPAZ,URBANA,PRIVADO,MONOLINGUE,VESPERTINA,DIARIO(REGULAR)
16-02-0055-46,16-006,ALTA VERAPAZ,SANTA CRUZ VERAPAZ,LICEO SANTA CRUZ,"CALLE 3 DE MAYO 2-67, BARRIO SANTO TOMAS",42035694,JORGE EDUARDO PAQUE LZARO,AUGUSTO ALEXANDER RAX RODR͇UEZ,DIVERSIFICADO,PRIVADO,URBANA,ABIERTA,MONOLINGUE,SIN JORNADA,SEMIPRESENCIAL (FIN DE SEMANA),ALTA VERAPAZ,alta_verapaz,LICEO SANTA CRUZ,"CALLE 3 DE MAYO 2-67, BARRIO SANTO TOMAS",42035694,AUGUSTO ALEXANDER RAX RODRUEZ,JORGE EDUARDO PAQUE LZARO,SANTA CRUZ VERAPAZ,URBANA,PRIVADO,MONOLINGUE,SIN JORNADA,SEMIPRESENCIAL (FIN DE SEMANA)
16-03-0036-46,16-053,ALTA VERAPAZ,SAN CRISTOBAL VERAPAZ,INSTITUTO NACIONAL DE EDUCACION DIVERSIFICADA,BARRIO CHIYUC,,LEONARDO OXOM CHEN,EDY ROLANDO JOM COY,DIVERSIFICADO,OFICIAL,RURAL,ABIERTA,MONOLINGUE,VESPERTINA,DIARIO(REGULAR),ALTA VERAPAZ,alta_verapaz,INSTITUTO NACIONAL DE EDUCACION DIVERSIFICADA,BARRIO CHIYUC,,EDY ROLANDO JOM COY,LEONARDO OXOM CHEN,SAN CRISTOBAL VERAPAZ,RURAL,OFICIAL,MONOLINGUE,VESPERTINA,DIARIO(REGULAR)
16-03-0047-46,16-008,ALTA VERAPAZ,SAN CRISTOBAL VERAPAZ,LICEO SAN CRISTOBAL,"5A. CALLE 4-18 ZONA 1, BARRIO SANTA ANA, SAN CRISTӂAL VERAPAZ",79504134,EMIILIO RUBɎ CAL GUALIB,OTTO ERIK MORN CHIQU͎,DIVERSIFICADO,PRIVADO,URBANA,ABIERTA,MONOLINGUE,DOBLE,FIN DE SEMANA,ALTA VERAPAZ,alta_verapaz,LICEO SAN CRISTOBAL,"5A. CALLE 4-18 ZONA 1, BARRIO SANTA ANA, SAN CRISTӁAL VERAPAZ",79504134,OTTO ERIK MORN CHIQU,EMIILIO RUBɎ CAL GUALIB,SAN CRISTOBAL VERAPAZ,URBANA,PRIVADO,MONOLINGUE,DOBLE,FIN DE SEMANA
16-03-0056-46,16-008,ALTA VERAPAZ,SAN CRISTOBAL VERAPAZ,INSTITUTO TECNOLOGICO VOCACIONAL MARCO TULIO DE LA CRUZ MORALES,"2A. CALLE ZONA 4, BARRIO SAN FELIPE",79504929,EMIILIO RUBɎ CAL GUALIB,RIGOBERTO HIGINIO SURAM JOM,DIVERSIFICADO,PRIVADO,URBANA,ABIERTA,MONOLINGUE,VESPERTINA,DIARIO(REGULAR),ALTA VERAPAZ,alta_verapaz,INSTITUTO TECNOLOGICO VOCACIONAL MARCO TULIO DE LA CRUZ MORALES,"2A. CALLE ZONA 4, BARRIO SAN FELIPE",79504929,RIGOBERTO HIGINIO SURAM JOM,EMIILIO RUBɎ CAL GUALIB,SAN CRISTOBAL VERAPAZ,URBANA,PRIVADO,MONOLINGUE,VESPERTINA,DIARIO(REGULAR)
16-03-0077-46,16-008,ALTA VERAPAZ,SAN CRISTOBAL VERAPAZ,COLEGIO MIXTO CIENCIAS TECNOLӇICAS,3A. CALLE 0-43 ZONA 3 BARRIO SAN SEBASTIAN,32386711,EMIILIO RUBɎ CAL GUALIB,MASSENA OSWALDO SAGASTUME PORTOCARRERO,DIVERSIFICADO,PRIVADO,URBANA,ABIERTA,MONOLINGUE,VESPERTINA,DIARIO(REGULAR),ALTA VERAPAZ,alta_verapaz,COLEGIO MIXTO CIENCIAS TECNOLӇICAS,3A. CALLE 0-43 ZONA 3 BARRIO SAN SEBASTIAN,32386711,MASSENA OSWALDO SAGASTUME PORTOCARRERO,EMIILIO RUBɎ CAL GUALIB,SAN CRISTOBAL VERAPAZ,URBANA,PRIVADO,MONOLINGUE,VESPERTINA,DIARIO(REGULAR)
16-03-0087-46,16-008,ALTA VERAPAZ,SAN CRISTOBAL VERAPAZ,INSTITUTO NACIONAL DE EDUCACION DIVERSIFICADA CON ORIENTACION EN ARTES Y OFICIOS,CASER͏ PANTOCAN,55288589,EMIILIO RUBɎ CAL GUALIB,JOEL DAVID LEM SURM,DIVERSIFICADO,OFICIAL,RURAL,ABIERTA,BILINGUE,MATUTINA,DIARIO(REGULAR),ALTA VERAPAZ,alta_verapaz,INSTITUTO NACIONAL DE EDUCACION DIVERSIFICADA CON ORIENTACION EN ARTES Y OFICIOS,CASER PANTOCAN,55288589,JOEL DAVID LEM SURM,EMIILIO RUBɎ CAL GUALIB,SAN CRISTOBAL VERAPAZ,RURAL,OFICIAL,BILINGUE,MATUTINA,DIARIO(REGULAR)
16-03-0092-46,16-008,ALTA VERAPAZ,SAN CRISTOBAL VERAPAZ,LICEO DE CIENCIAS APLICADAS DR. CARLOS ALDANA MENDOZA,"4. AVENIDA, ENTRE O Y 1 CALLE ZONA 4, BARRIO SAN FELIPE",31479184,EMIILIO RUBɎ CAL GUALIB,JUAN GABRIEL CAL SURM,DIVERSIFICADO,PRIVADO,URBANA,ABIERTA,MONOLINGUE,VESPERTINA,DIARIO(REGULAR),ALTA VERAPAZ,alta_verapaz,LICEO DE CIENCIAS APLICADAS DR. CARLOS ALDANA MENDOZA,"4. AVENIDA, ENTRE O Y 1 CALLE ZONA 4, BARRIO SAN FELIPE",31479184,JUAN GABRIEL CAL SURM,EMIILIO RUBɎ CAL GUALIB,SAN CRISTOBAL VERAPAZ,URBANA,PRIVADO,MONOLINGUE,VESPERTINA,DIARIO(REGULAR)
16-03-0093-46,16-008,ALTA VERAPAZ,SAN CRISTOBAL VERAPAZ,"INSTITUTO TECNOLOGICO VOCACIONAL ""MARCO TULIO DE LA CRUZ MORALES""","2A. CALLE 4-45 ZONA 4, BARRIO SAN FELIPE",79504929,EMIILIO RUBɎ CAL GUALIB,RIGOBERTO HIGINIO SURAM JOM,DIVERSIFICADO,PRIVADO,URBANA,ABIERTA,MONOLINGUE,DOBLE,FIN DE SEMANA,ALTA VERAPAZ,alta_verapaz,INSTITUTO TECNOLOGICO VOCACIONAL MARCO TULIO DE LA CRUZ MORALES,"2A. CALLE 4-45 ZONA 4, BARRIO SAN FELIPE",79504929,RIGOBERTO HIGINIO SURAM JOM,EMIILIO RUBɎ CAL GUALIB,SAN CRISTOBAL VERAPAZ,URBANA,PRIVADO,MONOLINGUE,DOBLE,FIN DE SEMANA
16-03-0095-46,16-008,ALTA VERAPAZ,SAN CRISTOBAL VERAPAZ,COLEGIO MIXTO LA PUPILA DEL CIELO,"4A. CALLE A 2-17, ENCLAVADO ZONA 2, COLONIA PAN|/td>",33801345,EMIILIO RUBɎ CAL GUALIB,MARIO RENE CAL SUN,DIVERSIFICADO,PRIVADO,URBANA,ABIERTA,MONOLINGUE,VESPERTINA,DIARIO(REGULAR),ALTA VERAPAZ,alta_verapaz,COLEGIO MIXTO LA PUPILA DEL CIELO,"4A. CALLE A 2-17, ENCLAVADO ZONA 2, COLONIA PANTD",33801345,MARIO RENE CAL SUN,EMIILIO RUBɎ CAL GUALIB,SAN CRISTOBAL VERAPAZ,URBANA,PRIVADO,MONOLINGUE,VESPERTINA,DIARIO(REGULAR)
16-03-0097-46,16-008,ALTA VERAPAZ,SAN CRISTOBAL VERAPAZ,COLEGIO MIXTO CIENCIAS TECNOLӇICAS,3A. CALLE 0-43 ZONA 3 BARRIO SAN SEBASTIAN,77923223,EMIILIO RUBɎ CAL GUALIB,MASSENA OSWALDO SAGASTUME PORTOCARRERO,DIVERSIFICADO,PRIVADO,URBANA,ABIERTA,MONOLINGUE,DOBLE,FIN DE SEMANA,ALTA VERAPAZ,alta_verapaz,COLEGIO MIXTO CIENCIAS TECNOLӇICAS,3A. CALLE 0-43 ZONA 3 BARRIO SAN SEBASTIAN,77923223,MASSENA OSWALDO SAGASTUME PORTOCARRERO,EMIILIO RUBɎ CAL GUALIB,SAN CRISTOBAL VERAPAZ,URBANA,PRIVADO,MONOLINGUE,DOBLE,FIN DE SEMANA
16-03-0104-46,16-008,ALTA VERAPAZ,SAN CRISTOBAL VERAPAZ,LICEO DE CIENCIAS APLICADAS DR. CARLOS ALDANA MENDOZA,"4. AVENIDA, ENTRE O Y 1 CALLE ZONA 4, BARRIO SAN FELIPE",79504090,EMIILIO RUBɎ CAL GUALIB,DELMY DAMARIZ CHOC LӐEZ,DIVERSIFICADO,PRIVADO,URBANA,ABIERTA,MONOLINGUE,MATUTINA,FIN DE SEMANA,ALTA VERAPAZ,alta_verapaz,LICEO DE CIENCIAS APLICADAS DR. CARLOS ALDANA MENDOZA,"4. AVENIDA, ENTRE O Y 1 CALLE ZONA 4, BARRIO SAN FELIPE",79504090,DELMY DAMARIZ CHOC LӐEZ,EMIILIO RUBɎ CAL GUALIB,SAN CRISTOBAL VERAPAZ,URBANA,PRIVADO,MONOLINGUE,MATUTINA,FIN DE SEMANA
16-03-0105-46,16-008,ALTA VERAPAZ,SAN CRISTOBAL VERAPAZ,LICEO DE CIENCIAS APLICADAS DR. CARLOS ALDANA MENDOZA,"4. AVENIDA, ENTRE O Y 1 CALLE ZONA 4, BARRIO SAN FELIPE",31479184,EMIILIO RUBɎ CAL GUALIB,JUAN GABRIEL CAL SURM,DIVERSIFICADO,PRIVADO,URBANA,ABIERTA,MONOLINGUE,DOBLE,FIN DE SEMANA,ALTA VERAPAZ,alta_verapaz,LICEO DE CIENCIAS APLICADAS DR. CARLOS ALDANA MENDOZA,"4. AVENIDA, ENTRE O Y 1 CALLE ZONA 4, BARRIO SAN FELIPE",31479184,JUAN GABRIEL CAL SURM,EMIILIO RUBɎ CAL GUALIB,SAN CRISTOBAL VERAPAZ,URBANA,PRIVADO,MONOLINGUE,DOBLE,FIN DE SEMANA
16-03-0106-46,16-008,ALTA VERAPAZ,SAN CRISTOBAL VERAPAZ,LICEO DE CIENCIAS APLICADAS DR. CARLOS ALDANA MENDOZA,"4. AVENIDA, ENTRE O Y 1 CALLE ZONA 4, BARRIO SAN FELIPE",79504090,EMIILIO RUBɎ CAL GUALIB,JUAN GABRIEL CAL SURM,DIVERSIFICADO,PRIVADO,URBANA,ABIERTA,MONOLINGUE,DOBLE,DIARIO(REGULAR),ALTA VERAPAZ,alta_verapaz,LICEO DE CIENCIAS APLICADAS DR. CARLOS ALDANA MENDOZA,"4. AVENIDA, ENTRE O Y 1 CALLE ZONA 4, BARRIO SAN FELIPE",79504090,JUAN GABRIEL CAL SURM,EMIILIO RUBɎ CAL GUALIB,SAN CRISTOBAL VERAPAZ,URBANA,PRIVADO,MONOLINGUE,DOBLE,DIARIO(REGULAR)
16-03-0110-46,16-008,ALTA VERAPAZ,SAN CRISTOBAL VERAPAZ,LICEO GALILEO GALILEI,"2A. CALLE, 2A. AVENIDA ZONA 3, BARRIO SAN SEBASTIAN",79504337,EMIILIO RUBɎ CAL GUALIB,MARIA ANGELICA GOMEZ CHAVEZ,DIVERSIFICADO,PRIVADO,URBANA,ABIERTA,MONOLINGUE,DOBLE,DIARIO(REGULAR),ALTA VERAPAZ,alta_verapaz,LICEO GALILEO GALILEI,"2A. CALLE, 2A. AVENIDA ZONA 3, BARRIO SAN SEBASTIAN",79504337,MARIA ANGELICA GOMEZ CHAVEZ,EMIILIO RUBɎ CAL GUALIB,SAN CRISTOBAL VERAPAZ,URBANA,PRIVADO,MONOLINGUE,DOBLE,DIARIO(REGULAR)
16-03-0139-46,16-008,ALTA VERAPAZ,SAN CRISTOBAL VERAPAZ,"INSTITUTO TECNOLӇICO VOCACIONAL ""MARCO TULIO DE LA CRUZ MORALES""","2A. CALLE 4-45 ZONA 4, BARRIO SAN FELIPE",79504929,EMIILIO RUBɎ CAL GUALIB,RIGOBERTO HIGINIO SURAM JOM,DIVERSIFICADO,PRIVADO,URBANA,ABIERTA,MONOLINGUE,SIN JORNADA,SEMIPRESENCIAL (FIN DE SEMANA),ALTA VERAPAZ,alta_verapaz,INSTITUTO TECNOLOGICO VOCACIONAL MARCO TULIO DE LA CRUZ MORALES,"2A. CALLE 4-45 ZONA 4, BARRIO SAN FELIPE",79504929,RIGOBERTO HIGINIO SURAM JOM,EMIILIO RUBɎ CAL GUALIB,SAN CRISTOBAL VERAPAZ,URBANA,PRIVADO,MONOLINGUE,SIN JORNADA,SEMIPRESENCIAL (FIN DE SEMANA)
16-03-0158-46,16-050,ALTA VERAPAZ,SAN CRISTOBAL VERAPAZ,CENTRO DE EDUCACIӎ EXTRAESCOLAR -CEEX-,COLONIA PANTOCN,46280307,MAXIMILIANO CHUB ICAL,SARA FLORIDALMA CڠTIUL,DIVERSIFICADO,PRIVADO,RURAL,ABIERTA,BILINGUE,DOBLE,SEMIPRESENCIAL,ALTA VERAPAZ,alta_verapaz,CENTRO DE EDUCACIӍ EXTRAESCOLAR -CEEX-,COLONIA PANTOCN,46280307,SARA FLORIDALMA CڠTIUL,MAXIMILIANO CHUB ICAL,SAN CRISTOBAL VERAPAZ,RURAL,PRIVADO,BILINGUE,DOBLE,SEMIPRESENCIAL
16-03-0243-46,16-008,ALTA VERAPAZ,SAN CRISTOBAL VERAPAZ,COLEGIO MIXTO CIENCIAS TECNOLOGICAS,"3A. CALLE 0-43 ZONA 3, BARRIO SAN SEBASTIAN",41705134,EMIILIO RUBɎ CAL GUALIB,MASSENA OSWALDO SAGASTUME PORTOCARRERO,DIVERSIFICADO,PRIVADO,URBANA,ABIERTA,MONOLINGUE,SIN JORNADA,SEMIPRESENCIAL (FIN DE SEMANA),ALTA VERAPAZ,alta_verapaz,COLEGIO MIXTO CIENCIAS TECNOLӇICAS,"3A. CALLE 0-43 ZONA 3, BARRIO SAN SEBASTIAN",41705134,MASSENA OSWALDO SAGASTUME PORTOCARRERO,EMIILIO RUBɎ CAL GUALIB,SAN CRISTOBAL VERAPAZ,URBANA,PRIVADO,MONOLINGUE,SIN JORNADA,SEMIPRESENCIAL (FIN DE SEMANA)
16-03-0245-46,16-008,ALTA VERAPAZ,SAN CRISTOBAL VERAPAZ,LICEO DE CIENCIAS APLICADAS DR. CARLOS ALDANA MENDOZA,"4A. AVENIDA, ENTRE 0 Y 1 CALLE ZONA 4, BARRIO SAN FELIPE",31479184,EMIILIO RUBɎ CAL GUALIB,JUAN GABRIEL CAL SURM,DIVERSIFICADO,PRIVADO,URBANA,ABIERTA,MONOLINGUE,SIN JORNADA,SEMIPRESENCIAL (FIN DE SEMANA),ALTA VERAPAZ,alta_verapaz,LICEO DE CIENCIAS APLICADAS DR. CARLOS ALDANA MENDOZA,"4A. AVENIDA, ENTRE 0 Y 1 CALLE ZONA 4, BARRIO SAN FELIPE",31479184,JUAN GABRIEL CAL SURM,EMIILIO RUBɎ CAL GUALIB,SAN CRISTOBAL VERAPAZ,URBANA,PRIVADO,MONOLINGUE,SIN JORNADA,SEMIPRESENCIAL (FIN DE SEMANA)
16-03-0247-46,16-008,ALTA VERAPAZ,SAN CRISTOBAL VERAPAZ,LICEO GALILEO GALILEI,"2A. CALLE 2A. AVENIDA ZONA 3, BARRIO SAN SEBASTIAN",45160622,EMIILIO RUBɎ CAL GUALIB,MARIA ANGELICA GOMEZ CHAVEZ,DIVERSIFICADO,PRIVADO,URBANA,ABIERTA,MONOLINGUE,SIN JORNADA,SEMIPRESENCIAL (FIN DE SEMANA),ALTA VERAPAZ,alta_verapaz,LICEO GALILEO GALILEI,"2A. CALLE 2A. AVENIDA ZONA 3, BARRIO SAN SEBASTIAN",45160622,MARIA ANGELICA GOMEZ CHAVEZ,EMIILIO RUBɎ CAL GUALIB,SAN CRISTOBAL VERAPAZ,URBANA,PRIVADO,MONOLINGUE,SIN JORNADA,SEMIPRESENCIAL (FIN DE SEMANA)
16-03-0259-46,16-008,ALTA VERAPAZ,SAN CRISTOBAL VERAPAZ,INSTITUTO TECNOLӇICO VOCACIONAL MARCO TULIO DE LA CRUZ MORALES,"2A. CALLE 4-45 ZONA 4, BARRIO SAN FELIPE",79504929,EMIILIO RUBɎ CAL GUALIB,RIGOBERTO HIGINIO SURAM JOM,DIVERSIFICADO,PRIVADO,URBANA,ABIERTA,MONOLINGUE,MATUTINA,DIARIO(REGULAR),ALTA VERAPAZ,alta_verapaz,INSTITUTO TECNOLOGICO VOCACIONAL MARCO TULIO DE LA CRUZ MORALES,"2A. CALLE 4-45 ZONA 4, BARRIO SAN FELIPE",79504929,RIGOBERTO HIGINIO SURAM JOM,EMIILIO RUBɎ CAL GUALIB,SAN CRISTOBAL VERAPAZ,URBANA,PRIVADO,MONOLINGUE,MATUTINA,DIARIO(REGULAR)
16-03-0262-46,16-008,ALTA VERAPAZ,SAN CRISTOBAL VERAPAZ,COLEGIO MIXTO LA PUPILA DEL CIELO,"4A. CALLE A 2-17, ENCLAVADO ZONA 2, COLONIA PAN|/td>",33801345,EMIILIO RUBɎ CAL GUALIB,MARIO RENE CAL SUN,DIVERSIFICADO,PRIVADO,URBANA,ABIERTA,MONOLINGUE,SIN JORNADA,SEMIPRESENCIAL (FIN DE SEMANA),ALTA VERAPAZ,alta_verapaz,COLEGIO MIXTO LA PUPILA DEL CIELO,"4A. CALLE A 2-17, ENCLAVADO ZONA 2, COLONIA PANTD",33801345,MARIO RENE CAL SUN,EMIILIO RUBɎ CAL GUALIB,SAN CRISTOBAL VERAPAZ,URBANA,PRIVADO,MONOLINGUE,SIN JORNADA,SEMIPRESENCIAL (FIN DE SEMANA)
16-03-0263-46,16-008,ALTA VERAPAZ,SAN CRISTOBAL VERAPAZ,COLEGIO MIXTO LA PUPILA DEL CIELO,"4A. CALLE A 2-17, ENCLAVADO ZONA 2, COLONIA PAN|/td>",33801345,EMIILIO RUBɎ CAL GUALIB,MARIO RENE CAL SUN,DIVERSIFICADO,PRIVADO,URBANA,ABIERTA,MONOLINGUE,DOBLE,FIN DE SEMANA,ALTA VERAPAZ,alta_verapaz,COLEGIO MIXTO LA PUPILA DEL CIELO,"4A. CALLE A 2-17, ENCLAVADO ZONA 2, COLONIA PANTD",33801345,MARIO RENE CAL SUN,EMIILIO RUBɎ CAL GUALIB,SAN CRISTOBAL VERAPAZ,URBANA,PRIVADO,MONOLINGUE,DOBLE,FIN DE SEMANA
16-03-0265-46,16-008,ALTA VERAPAZ,SAN CRISTOBAL VERAPAZ,LICEO SAN CRISTӂAL,"5A. CALLE 4-18 ZONA 1, BARRIO SANTA ANA",57332422,EMIILIO RUBɎ CAL GUALIB,OTTO ERIK MORN CHIQU͎,DIVERSIFICADO,PRIVADO,URBANA,ABIERTA,MONOLINGUE,SIN JORNADA,SEMIPRESENCIAL (FIN DE SEMANA),ALTA VERAPAZ,alta_verapaz,LICEO SAN CRISTOBAL,"5A. CALLE 4-18 ZONA 1, BARRIO SANTA ANA",57332422,OTTO ERIK MORN CHIQU,EMIILIO RUBɎ CAL GUALIB,SAN CRISTOBAL VERAPAZ,URBANA,PRIVADO,MONOLINGUE,SIN JORNADA,SEMIPRESENCIAL (FIN DE SEMANA)
16-03-0266-46,16-050,ALTA VERAPAZ,SAN CRISTOBAL VERAPAZ,CENTRO DE EDUCACIӎ EXTRAESCOLAR -CEEX-,CASER͏ CHILLEY,45552665,MAXIMILIANO CHUB ICAL,HENRY MANUEL HIDALGO SACB|/td>,DIVERSIFICADO,OFICIAL,RURAL,ABIERTA,BILINGUE,DOBLE,DIARIO(REGULAR),ALTA VERAPAZ,alta_verapaz,CENTRO DE EDUCACIӍ EXTRAESCOLAR -CEEX-,CASER CHILLEY,45552665,HENRY MANUEL HIDALGO SACBTD,MAXIMILIANO CHUB ICAL,SAN CRISTOBAL VERAPAZ,RURAL,OFICIAL,BILINGUE,DOBLE,DIARIO(REGULAR)
16-03-0270-46,16-008,ALTA VERAPAZ,SAN CRISTOBAL VERAPAZ,COLEGIO DE FORMACIӎ TɃNICO-PROFESIONAL NEXUS,"0 AVENIDA 1-71 ZONA 5, SAN CRISTOBAL VERAPAZ",35883366,EMIILIO RUBɎ CAL GUALIB,MAŔ JOSɠBEJARANO YAGGI,DIVERSIFICADO,PRIVADO,URBANA,ABIERTA,MONOLINGUE,MATUTINA,DIARIO(REGULAR),ALTA VERAPAZ,alta_verapaz,COLEGIO DE FORMACIӍ TɃNICO-PROFESIONAL NEXUS,"0 AVENIDA 1-71 ZONA 5, SAN CRISTOBAL VERAPAZ",35883366,MAR JOSƓBEJARANO YAGGI,EMIILIO RUBɎ CAL GUALIB,SAN CRISTOBAL VERAPAZ,URBANA,PRIVADO,MONOLINGUE,MATUTINA,DIARIO(REGULAR)
16-03-0271-46,16-008,ALTA VERAPAZ,SAN CRISTOBAL VERAPAZ,COLEGIO DE FORMACIӎ TɃNICO-PROFESIONAL NEXUS,"0 AVENIDA 1-71 ZONA 5, SAN CRISTOBAL VERAPAZ",35883366,EMIILIO RUBɎ CAL GUALIB,MAŔ JOSɠBEJARANO YAGGI,DIVERSIFICADO,PRIVADO,URBANA,ABIERTA,MONOLINGUE,VESPERTINA,DIARIO(REGULAR),ALTA VERAPAZ,alta_verapaz,COLEGIO DE FORMACIӍ TɃNICO-PROFESIONAL NEXUS,"0 AVENIDA 1-71 ZONA 5, SAN CRISTOBAL VERAPAZ",35883366,MAR JOSƓBEJARANO YAGGI,EMIILIO RUBɎ CAL GUALIB,SAN CRISTOBAL VERAPAZ,URBANA,PRIVADO,MONOLINGUE,VESPERTINA,DIARIO(REGULAR)
